{
  "$defs": {
    "ExampleFile": {
      "description": "A file an example assumes besides its page.",
      "properties": {
        "path": {
          "description": "Its content path.",
          "type": "string"
        },
        "text": {
          "description": "Its text.",
          "type": "string"
        }
      },
      "required": [
        "path",
        "text"
      ],
      "type": "object"
    },
    "ExampleText": {
      "description": "A diagnostic's example.",
      "properties": {
        "files": {
          "description": "The project's other files the example assumes, in path order.",
          "items": {
            "$ref": "#/$defs/ExampleFile"
          },
          "type": "array"
        },
        "model": {
          "description": "The content model the example assumes, when the problem depends on\none: the example's own fragment, or else the explain model. `null`\nwhen it's a problem under any content model.",
          "type": [
            "string",
            "null"
          ]
        },
        "right": {
          "description": "The same page, fixed.",
          "type": "string"
        },
        "wrong": {
          "description": "The page, `page.md`, with the problem.",
          "type": "string"
        }
      },
      "required": [
        "wrong",
        "right",
        "model",
        "files"
      ],
      "type": "object"
    },
    "MessageVariant": {
      "description": "Another wording of a diagnostic's message.",
      "properties": {
        "message": {
          "description": "The message, with its placeholders as written.",
          "type": "string"
        },
        "name": {
          "description": "The case it's for.",
          "type": "string"
        }
      },
      "required": [
        "name",
        "message"
      ],
      "type": "object"
    }
  },
  "$schema": "https://json-schema.org/draft/2020-12/schema",
  "description": "What `ascribe explain <CODE>` answers: one diagnostic.",
  "properties": {
    "ascribe_version": {
      "description": "The version of Ascribe that wrote it.",
      "type": "string"
    },
    "code": {
      "description": "The code, such as `ASC036`.",
      "type": "string"
    },
    "docs": {
      "description": "The address of its entry in the diagnostics reference: the docs'\npermalink for its code, such as `https://ascribed-dev.com/go/ASC036/`,\nwhich forwards to the entry wherever it is.",
      "type": "string"
    },
    "example": {
      "anyOf": [
        {
          "$ref": "#/$defs/ExampleText"
        },
        {
          "type": "null"
        }
      ],
      "description": "A page that has the problem and the same page fixed; `null` when the\ndiagnostic has no example."
    },
    "fix": {
      "description": "How to fix it, in general. `null` for a diagnostic that's no longer\nreported.",
      "type": [
        "string",
        "null"
      ]
    },
    "level": {
      "description": "`file` for a problem found in each file on its own; `page` for one\nfound in each page as a build resolves it.",
      "type": "string"
    },
    "message": {
      "description": "The message, with its placeholders (`{path}`) as written.",
      "type": "string"
    },
    "next": {
      "description": "The kind of next step: `fix`, `choose`, `write`, `outside`, or\n`review`. `null` for a diagnostic that's no longer reported.",
      "type": [
        "string",
        "null"
      ]
    },
    "schema_version": {
      "description": "The version of this schema. It changes only when a field is removed\nor changes meaning.",
      "format": "uint32",
      "minimum": 0,
      "type": "integer"
    },
    "severity": {
      "description": "`error`, `warning`, or `advice`.",
      "type": "string"
    },
    "slug": {
      "description": "The diagnostic's name, such as `link-target-missing`.",
      "type": "string"
    },
    "variants": {
      "description": "The other ways the message is worded, by the case they're for, in\nname order.",
      "items": {
        "$ref": "#/$defs/MessageVariant"
      },
      "type": "array"
    }
  },
  "required": [
    "schema_version",
    "ascribe_version",
    "code",
    "slug",
    "severity",
    "next",
    "level",
    "message",
    "variants",
    "fix",
    "docs",
    "example"
  ],
  "title": "ExplainReport",
  "type": "object"
}
